{
  "schema_version": "inference-profile/v1",
  "profile_id": "openai-gpt-5.6-accuracy-v1",
  "provider": "openai",
  "api": "responses",
  "model": "gpt-5.6",
  "model_resolution_policy": "record_response_model",
  "reasoning_effort": "medium",
  "structured_output": {"type": "json_schema", "strict": true},
  "prompt": {
    "version": "problem-evidence-v1",
    "path": "configs/extraction/prompts/problem-evidence-v1.txt",
    "sha256": "26ffcdf47c93542b0632c0f773d398a1978834528a57c3eaa706c86e1fd60254"
  },
  "extraction_schema": {
    "version": "extraction-v0.1",
    "path": "schemas/model-extraction-output.schema.json",
    "sha256": "fb9706146ba90359fc3026a52b7f633cf2b62e651b913d1897fe2db67315d270"
  },
  "source_policy": {
    "source_role": "calibration_source",
    "sources": ["github", "stackexchange", "steam", "ted"]
  },
  "experiment": {
    "max_profiles": 1,
    "max_metric_runs": 1,
    "allow_metric_failure_fallback": false,
    "allow_calibration_retuning": false
  },
  "limits": {
    "input_count": 40,
    "max_retries_per_document": 2,
    "max_cost_usd": 5,
    "max_wall_seconds": 1800,
    "max_output_tokens": 1200
  },
  "pricing": {
    "currency": "USD",
    "input_usd_per_million": 4,
    "output_usd_per_million": 20
  },
  "retention": {
    "persist_raw_response": false,
    "persist_source_text": false,
    "persist_request_id": false,
    "persist_sanitized_outputs": false
  },
  "secret": {"environment_variable": "OPENAI_API_KEY", "persist_value": false}
}
